{
  "contract_version": 1,
  "protected_branches": ["main"],
  "host_capabilities": {
    "branch_protection": "available",
    "rulesets": "available",
    "required_checks": "available"
  },
  "labels": [
    {
      "name": "status:approved",
      "class": "host-enforced"
    },
    {
      "name": "chain:partial",
      "class": "host-enforced"
    },
    {
      "name": "status:blocked",
      "class": "documented-only"
    }
  ],
  "required_checks": [
    {
      "name": "required",
      "class": "host-enforced"
    }
  ],
  "merge_methods": {
    "allow_merge_commit": {
      "declared": true,
      "class": "host-enforced"
    },
    "allow_squash_merge": {
      "declared": false,
      "class": "host-enforced"
    },
    "allow_rebase_merge": {
      "declared": false,
      "class": "host-enforced"
    },
    "allow_auto_merge": {
      "declared": true,
      "class": "host-enforced"
    }
  },
  "protection": {
    "enforce_admins": {
      "declared": true,
      "class": "host-enforced"
    },
    "required_linear_history": {
      "declared": true,
      "class": "host-enforced"
    },
    "required_conversation_resolution": {
      "declared": true,
      "class": "documented-only"
    },
    "allow_force_pushes": {
      "declared": false,
      "class": "host-enforced"
    },
    "allow_deletions": {
      "declared": false,
      "class": "host-enforced"
    }
  },
  "rulesets": [
    {
      "name": "default-branch-ruleset",
      "enforcement": "active",
      "class": "host-enforced"
    }
  ]
}
